<?xml version="1.0" encoding="UTF-8"?>
<tns:FindPrescriptionsResponse xmlns:tns="http://www.example.org/FindPrescriptionsResponse" xmlns:xsi="http://www.w3.org/2001/XMLSchema-instance" xsi:schemaLocation="http://www.example.org/FindPrescriptionsResponse FindPrescriptionsResponse.xsd ">
  <tns:prescriptions>
    <tns:prescription>
      <tns:rxNumber>tns:rxNumber</tns:rxNumber>
      <tns:locaNumber>tns:locaNumber</tns:locaNumber>
      <tns:dateOfService>tns:dateOfService</tns:dateOfService>
      <tns:daysSupplyQuantity>tns:daysSupplyQuantity</tns:daysSupplyQuantity>
      <tns:lastFilllDate>tns:lastFilllDate</tns:lastFilllDate>
      <tns:dosageQuantity>tns:dosageQuantity</tns:dosageQuantity>
      <tns:fillingPharmacy>tns:fillingPharmacy</tns:fillingPharmacy>
      <tns:enrollmentIndicator>tns:enrollmentIndicator</tns:enrollmentIndicator>
      <tns:isEligible>tns:isEligible</tns:isEligible>
      <tns:nonEligibleReasonCode>tns:nonEligibleReasonCode</tns:nonEligibleReasonCode>
      <tns:prescriber>
        <tns:id>tns:id</tns:id>
        <tns:firstName>tns:firstName</tns:firstName>
        <tns:lastName>tns:lastName</tns:lastName>
        <tns:homeAddress>
          <tns:line1>tns:line1</tns:line1>
          <tns:line2>tns:line2</tns:line2>
          <tns:state>tns:state</tns:state>
          <tns:city>tns:city</tns:city>
          <tns:zipcode>tns:zipcode</tns:zipcode>
        </tns:homeAddress>
        <tns:workAddress>
          <tns:line1>tns:line1</tns:line1>
          <tns:line2>tns:line2</tns:line2>
          <tns:state>tns:state</tns:state>
          <tns:city>tns:city</tns:city>
          <tns:zipcode>tns:zipcode</tns:zipcode>
        </tns:workAddress>
        <tns:licenseNumber>tns:licenseNumber</tns:licenseNumber>
      </tns:prescriber>
      <tns:drug>
        <tns:name>tns:name</tns:name>
        <tns:type>tns:type</tns:type>
        <tns:speciality>tns:speciality</tns:speciality>
        <tns:ndc>tns:ndc</tns:ndc>
      </tns:drug>
    </tns:prescription>
  </tns:prescriptions>
  <tns:numberOfPrescriptions>tns:numberOfPrescriptions</tns:numberOfPrescriptions>
</tns:FindPrescriptionsResponse>
